product type,abstract,instrument,platform,platformSerialIdentifier,processingLevel,keywords,sensorType,license,title,missionStartDate,_id,aws_eos,cop_ads,cop_cds,cop_dataspace,cop_ewds,cop_marine,creodias,creodias_s3,dedl,dedt_lumi,earth_search,earth_search_cog,earth_search_gcs,ecmwf,eumetsat_ds,fedeo_ceda,geodes,geodes_s3,hydroweb_next,meteoblue,peps,planetary_computer,sara,usgs,usgs_satapi_aws,wekeo_cmems,wekeo_ecmwf,wekeo_main
AERIS_IAGOS,"The mission of IAGOS is to provide high quality data throughout the tropopshere and lower stratosphere, and scientific expertise to understand the evolution of atmospheric composition, air quality, and climate. ","IAGOS-CORE,IAGOS-MOZAIC,IAGOS-CARIBIC",,,L2,"AERIS, AIRCRAFT, ATMOSPHERIC, IAGOS, L2",ATMOSPHERIC,other,In-service Aircraft for a Global Observing System,1994-08-01T00:00:00Z,AERIS_IAGOS,,,,,,,,,available,,,,,,,,,,,,,,,,,,,
AG_ERA5,"This dataset provides daily surface meteorological data for the period from 1979 to present as input for agriculture and agro-ecological studies. This dataset is based on the hourly ECMWF ERA5 data at surface level and is referred to as AgERA5. Acquisition and pre-processing of the original ERA5 data is a complex and specialized job. By providing the AgERA5 dataset, users are freed from this work and can directly start with meaningful input for their analyses and modelling. To this end, the variables provided in this dataset match the input needs of most agriculture and agro-ecological models. Data were aggregated to daily time steps at the local time zone and corrected towards a finer topography at a 0.1째 spatial resolution. The correction to the 0.1째 grid was realized by applying grid and variable-specific regression equations to the ERA5 dataset interpolated at 0.1째 grid. The equations were trained on ECMWF's operational high-resolution atmospheric model (HRES) at a 0.1째 resolution. This way the data is tuned to the finer topography, finer land use pattern and finer land-sea delineation of the ECMWF HRES model. The data was produced on behalf of the Copernicus Climate Change Service. ",,ERA5,ERA5,,"ECMWF,Reanalysis,ERA5,CDS,Atmospheric,climate,land,agriculture,AgERA5,surface",ATMOSPHERIC,other,Agrometeorological indicators from 1979 to present derived from reanalysis,1979-01-01T00:00:00Z,AG_ERA5,,,available,,,,,,,,,,,,,,,,,,,,,,,,available,
CAMS_EAC4,"EAC4 (ECMWF Atmospheric Composition Reanalysis 4) is the fourth generation ECMWF global reanalysis of atmospheric composition. Reanalysis combines model data with observations from across the world into a globally complete and consistent dataset using a model of the atmosphere based on the laws of physics and chemistry. This principle, called data assimilation, is based on the method used by numerical weather prediction centres and air quality forecasting centres, where every so many hours (12 hours at ECMWF) a previous forecast is combined with newly available observations in an optimal way to produce a new best estimate of the state of the atmosphere, called analysis, from which an updated, improved forecast is issued. Reanalysis works in the same way to allow for the provision of a dataset spanning back more than a decade. Reanalysis does not have the constraint of issuing timely forecasts, so there is more time to collect observations, and when going further back in time, to allow for the ingestion of improved versions of the original observations, which all benefit the quality of the reanalysis product. The assimilation system is able to estimate biases between observations and to sift good-quality data from poor data. The atmosphere model allows for estimates at locations where data coverage is low or for atmospheric pollutants for which no direct observations are available. The provision of estimates at each grid point around the globe for each regular output time, over a long period, always using the same format, makes reanalysis a very convenient and popular dataset to work with. The observing system has changed drastically over time, and although the assimilation system can resolve data holes, the initially much sparser networks will lead to less accurate estimates. For this reason, EAC4 is only available from 2003 onwards. Although the analysis procedure considers chunks of data in a window of 12 hours in one go, EAC4 provides estimates every 3 hours, worldwide. This is made possible by the 4D-Var assimilation method, which takes account of the exact timing of the observations and model evolution within the assimilation window. ",,CAMS,CAMS,,"Copernicus,ADS,CAMS,Atmosphere,Atmospheric,EWMCF,EAC4",ATMOSPHERIC,other,CAMS global reanalysis (EAC4),2003-01-01T00:00:00Z,CAMS_EAC4,,available,,,,,,,available,,,,,,,,,,,,,,,,,,available,
CAMS_EAC4_MONTHLY,"EAC4 (ECMWF Atmospheric Composition Reanalysis 4) is the fourth generation ECMWF global reanalysis of atmospheric composition. Reanalysis combines model data with observations from across the world into a globally complete and consistent dataset using a model of the atmosphere based on the laws of physics and chemistry. This principle, called data assimilation, is based on the method used by numerical weather prediction centres and air quality forecasting centres, where every so many hours (12 hours at ECMWF) a previous forecast is combined with newly available observations in an optimal way to produce a new best estimate of the state of the atmosphere, called analysis, from which an updated, improved forecast is issued. Reanalysis works in the same way to allow for the provision of a dataset spanning back more than a decade. Reanalysis does not have the constraint of issuing timely forecasts, so there is more time to collect observations, and when going further back in time, to allow for the ingestion of improved versions of the original observations, which all benefit the quality of the reanalysis product. The assimilation system is able to estimate biases between observations and to sift good-quality data from poor data. The atmosphere model allows for estimates at locations where data coverage is low or for atmospheric pollutants for which no direct observations are available. The provision of estimates at each grid point around the globe for each regular output time, over a long period, always using the same format, makes reanalysis a very convenient and popular dataset to work with. The observing system has changed drastically over time, and although the assimilation system can resolve data holes, the initially much sparser networks will lead to less accurate estimates. For this reason, EAC4 is only available from 2003 onwards. Although the analysis procedure considers chunks of data in a window of 12 hours in one go, EAC4 provides estimates every 3 hours, worldwide. This is made possible by the 4D-Var assimilation method, which takes account of the exact timing of the observations and model evolution within the assimilation window. ",,CAMS,CAMS,,"Copernicus,ADS,CAMS,Atmosphere,Atmospheric,EWMCF,EAC4",ATMOSPHERIC,other,CAMS global reanalysis (EAC4) monthly averaged fields,2003-01-01T00:00:00Z,CAMS_EAC4_MONTHLY,,available,,,,,,,available,,,,,,,,,,,,,,,,,,available,
CAMS_EU_AIR_QUALITY_FORECAST,"This dataset provides daily air quality analyses and forecasts for Europe. CAMS produces specific daily air quality analyses and forecasts for the European domain at significantly higher spatial resolution (0.1 degrees, approx. 10km) than is available from the global analyses and forecasts. The production is based on an ensemble of eleven air quality forecasting systems across Europe. A median ensemble is calculated from individual outputs, since ensemble products yield on average better performance than the individual model products. The spread between the eleven models are used to provide an estimate of the forecast uncertainty. The analysis combines model data with observations provided by the European Environment Agency (EEA) into a complete and consistent dataset using various data assimilation techniques depending upon the air-quality forecasting system used. In parallel, air quality forecasts are produced once a day for the next four days. Both the analysis and the forecast are available at hourly time steps at seven height levels. Note that only nitrogen monoxide, nitrogen dioxide, sulphur dioxide, ozone, PM2.5, PM10 and dust are regularly validated against in situ observations, and therefore forecasts of all other variables are unvalidated and should be considered experimental. ",,CAMS,CAMS,,"Copernicus,ADS,CAMS,Atmosphere,Atmospheric,Air,Forecast,EEA",ATMOSPHERIC,other,CAMS European air quality forecasts,2022-01-03T00:00:00Z,CAMS_EU_AIR_QUALITY_FORECAST,,available,,,,,,,available,,,,,,,,,,,,,,,,,,available,
CAMS_EU_AIR_QUALITY_RE,"This dataset provides annual air quality reanalyses for Europe based on both unvalidated (interim) and validated observations. CAMS produces annual air quality (interim) reanalyses for the European domain at significantly higher spatial resolution (0.1 degrees, approx. 10km) than is available from the global reanalyses. The production is currently based on an ensemble of nine air quality data assimilation systems across Europe. A median ensemble is calculated from individual outputs, since ensemble products yield on average better performance than the individual model products. The spread between the nine models can be used to provide an estimate of the analysis uncertainty. The reanalysis combines model data with observations provided by the European Environment Agency (EEA) into a complete and consistent dataset using various data assimilation techniques depending upon the air-quality forecasting system used. Additional sources of observations can complement the in-situ data assimilation, like satellite data. An interim reanalysis is provided each year for the year before based on the unvalidated near-real-time observation data stream that has not undergone full quality control by the data providers yet. Once the fully quality-controlled observations are available from the data provider, typically with an additional delay of about 1 year, a final validated annual reanalysis is provided. Both reanalyses are available at hourly time steps at height levels. ",,CAMS,CAMS,,"Copernicus,ADS,CAMS,Atmosphere,Atmospheric,Air,EEA",ATMOSPHERIC,other,CAMS European air quality reanalyses,2013-01-01T00:00:00Z,CAMS_EU_AIR_QUALITY_RE,,available,,,,,,,available,,,,,,,,,,,,,,,,,,available,
CAMS_GAC_FORECAST,"CAMS produces global forecasts for atmospheric composition twice a day. The forecasts consist of more than 50 chemical species (e.g. ozone, nitrogen dioxide, carbon monoxide) and seven different types of aerosol (desert dust, sea salt, organic matter, black carbon, sulphate, nitrate and ammonium aerosol). In addition, several meteorological variables are available as well. The initial conditions of each forecast are obtained by combining a previous forecast with current satellite observations through a process called data assimilation. This best estimate of the state of the atmosphere at the initial forecast time step, called the analysis, provides a globally complete and consistent dataset allowing for estimates at locations where observation data coverage is low or for atmospheric pollutants for which no direct observations are available. The forecast itself uses a model of the atmosphere based on the laws of physics and chemistry to determine the evolution of the concentrations of all species over time for the next five days. Apart from the required initial state, it also uses inventory-based or observation-based emission estimates as a boundary condition at the surface. The CAMS global forecasting system is upgraded about once a year resulting in technical and scientific changes. The horizontal or vertical resolution can change, new species can be added, and more generally the accuracy of the forecasts can be improved. Details of these system changes can be found in the documentation. Users looking for a more consistent long-term data set should consider using the CAMS Global Reanalysis instead, which is available through the ADS and spans the period from 2003 onwards. Finally, because some meteorological fields in the forecast do not fall within the general CAMS data licence, they are only available with a delay of 5 days. ",,CAMS,CAMS,,"Copernicus,ADS,CAMS,Atmosphere,Atmospheric,Forecast,GAC",ATMOSPHERIC,other,CAMS global atmospheric composition forecasts,2015-01-01T00:00:00Z,CAMS_GAC_FORECAST,,available,,,,,,,available,,,,,,,,,,,,,,,,,,available,
CAMS_GFE_GFAS,"Emissions of atmospheric pollutants from biomass burning and vegetation fires are key drivers of the evolution of atmospheric composition, with a high degree of spatial and temporal variability, and an accurate representation of them in models is essential. The CAMS Global Fire Assimilation System (GFAS) utilises satellite observations of fire radiative power (FRP) to provide near-real-time information on the location, relative intensity and estimated emissions from biomass burning and vegetation fires. Emissions are estimated by (i) conversion of FRP observations to the dry matter (DM) consumed by the fire, and (ii) application of emission factors to DM for different biomes, based on field and laboratory studies in the scientific literature, to estimate the emissions. Emissions estimates for 40 pyrogenic species are available from GFAS, including aerosols, reactive gases and greenhouse gases, on a regular grid with a spatial resolution of 0.1 degrees longitude by 0.1 degrees latitude. This version of GFAS (v1.2) provides daily averaged data based on a combination of FRP observations from two Moderate Resolution Imaging Spectroradiometer (MODIS) instruments, one on the NASA EOS-Terra satellite and the other on the NASA EOS-Aqua satellite from 1 January 2003 to present. GFAS also provides daily estimates of smoke plume injection heights derived from FRP observations and meteorological information from the operational weather forecasts from ECMWF. GFAS data have been used to provide surface boundary conditions for the CAMS global atmospheric composition and European regional air quality forecasts, and the wider atmospheric chemistry modelling community. ",,CAMS,CAMS,,"Copernicus,ADS,CAMS,Atmosphere,Atmospheric,Fire,FRP,DM,MODIS,NASA,EOS,ECMWF,GFAS",ATMOSPHERIC,other,CAMS global biomass burning emissions based on fire radiative power (GFAS),2003-01-01T00:00:00Z,CAMS_GFE_GFAS,,available,,,,,,,available,,,,,,,,,,,,,,,,,,available,
CAMS_GLOBAL_EMISSIONS,"This data set contains gridded distributions of global anthropogenic and natural emissions. Natural and anthropogenic emissions of atmospheric pollutants and greenhouse gases are key drivers of the evolution of the composition of the atmosphere, so an accurate representation of them in forecast models of atmospheric composition is essential. CAMS compiles inventories of emission data that serve as input to its own forecast models, but which can also be used by other atmospheric chemical transport models. These inventories are based on a combination of existing data sets and new information, describing anthropogenic emissions from fossil fuel use on land, shipping, and aviation, and natural emissions from vegetation, soil, the ocean and termites. The anthropogenic emissions on land are further separated in specific activity sectors (e.g., power generation, road traffic, industry). The CAMS emission data sets provide good consistency between the emissions of greenhouse gases, reactive gases, and aerosol particles and their precursors. Because most inventory-based data sets are only available with a delay of several years, the CAMS emission inventories also extend these existing data sets forward in time by using the trends from the most recent available years, producing timely input data for real-time forecast models. Most of the data sets are updated once or twice per year adding the most recent year to the data record, while re-processing the original data record for consistency, when needed. This is reflected by the different version numbers. ",,CAMS,CAMS,,"Copernicus,ADS,CAMS,Atmosphere,Atmospheric,Emissions,Pollutants,GHG",ATMOSPHERIC,other,CAMS global emission inventories,2000-01-01T00:00:00Z,CAMS_GLOBAL_EMISSIONS,,available,,,,,,,available,,,,,,,,,,,,,,,,,,available,
CAMS_GREENHOUSE_EGG4,"This dataset is part of the ECMWF Atmospheric Composition Reanalysis focusing on long-lived greenhouse gases: carbon dioxide (CO2) and methane (CH4). The emissions and natural fluxes at the surface are crucial for the evolution of the long-lived greenhouse gases in the atmosphere. In this dataset the CO2 fluxes from terrestrial vegetation are modelled in order to simulate the variability across a wide range of scales from diurnal to inter-annual. The CH4 chemical loss is represented by a climatological loss rate and the emissions at the surface are taken from a range of datasets. Reanalysis combines model data with observations from across the world into a globally complete and consistent dataset using a model of the atmosphere based on the laws of physics and chemistry. This principle, called data assimilation, is based on the method used by numerical weather prediction centres and air quality forecasting centres, where every so many hours (12 hours at ECMWF) a previous forecast is combined with newly available observations in an optimal way to produce a new best estimate of the state of the atmosphere, called analysis, from which an updated, improved forecast is issued. Reanalysis works in the same way to allow for the provision of a dataset spanning back more than a decade. Reanalysis does not have the constraint of issuing timely forecasts, so there is more time to collect observations, and when going further back in time, to allow for the ingestion of improved versions of the original observations, which all benefit the quality of the reanalysis product. The assimilation system is able to estimate biases between observations and to sift good-quality data from poor data. The atmosphere model allows for estimates at locations where data coverage is low or for atmospheric pollutants for which no direct observations are available. The provision of estimates at each grid point around the globe for each regular output time, over a long period, always using the same format, makes reanalysis a very convenient and popular dataset to work with. The observing system has changed drastically over time, and although the assimilation system can resolve data holes, the initially much sparser networks will lead to less accurate estimates. For this reason, EAC4 is only available from 2003 onwards. The analysis procedure assimilates data in a window of 12 hours using the 4D-Var assimilation method, which takes account of the exact timing of the observations and model evolution within the assimilation window. ",,CAMS,CAMS,,"Copernicus,ADS,CAMS,Atmospheric,Atmosphere,CO2,CH4,GHG,ECMWF,EGG4",ATMOSPHERIC,other,CAMS global greenhouse gas reanalysis (EGG4),2003-01-01T00:00:00Z,CAMS_GREENHOUSE_EGG4,,available,,,,,,,available,,,,,,,,,,,,,,,,,,available,
CAMS_GREENHOUSE_EGG4_MONTHLY,"This dataset is part of the ECMWF Atmospheric Composition Reanalysis focusing on long-lived greenhouse gases: carbon dioxide (CO2) and methane (CH4). The emissions and natural fluxes at the surface are crucial for the evolution of the long-lived greenhouse gases in the atmosphere. In this dataset the CO2 fluxes from terrestrial vegetation are modelled in order to simulate the variability across a wide range of scales from diurnal to inter-annual. The CH4 chemical loss is represented by a climatological loss rate and the emissions at the surface are taken from a range of datasets. Reanalysis combines model data with observations from across the world into a globally complete and consistent dataset using a model of the atmosphere based on the laws of physics and chemistry. This principle, called data assimilation, is based on the method used by numerical weather prediction centres and air quality forecasting centres, where every so many hours (12 hours at ECMWF) a previous forecast is combined with newly available observations in an optimal way to produce a new best estimate of the state of the atmosphere, called analysis, from which an updated, improved forecast is issued. Reanalysis works in the same way to allow for the provision of a dataset spanning back more than a decade. Reanalysis does not have the constraint of issuing timely forecasts, so there is more time to collect observations, and when going further back in time, to allow for the ingestion of improved versions of the original observations, which all benefit the quality of the reanalysis product. The assimilation system is able to estimate biases between observations and to sift good-quality data from poor data. The atmosphere model allows for estimates at locations where data coverage is low or for atmospheric pollutants for which no direct observations are available. The provision of estimates at each grid point around the globe for each regular output time, over a long period, always using the same format, makes reanalysis a very convenient and popular dataset to work with. The observing system has changed drastically over time, and although the assimilation system can resolve data holes, the initially much sparser networks will lead to less accurate estimates. For this reason, EAC4 is only available from 2003 onwards. The analysis procedure assimilates data in a window of 12 hours using the 4D-Var assimilation method, which takes account of the exact timing of the observations and model evolution within the assimilation window. ",,CAMS,CAMS,,"Copernicus,ADS,CAMS,Atmospheric,Atmosphere,CO2,CH4,Greenhouse,ECMWF,EGG4",ATMOSPHERIC,other,CAMS global greenhouse gas reanalysis (EGG4) monthly averaged fields,2003-01-01T00:00:00Z,CAMS_GREENHOUSE_EGG4_MONTHLY,,available,,,,,,,available,,,,,,,,,,,,,,,,,,available,
CAMS_GREENHOUSE_INVERSION,"This data set contains net fluxes at the surface, atmospheric mixing ratios at model levels, and column-mean atmospheric mixing ratios for carbon dioxide (CO2), methane (CH4) and nitrous oxide (N20). Natural and anthropogenic surface fluxes of greenhouse gases are key drivers of the evolution of Earth's climate, so their monitoring is essential. Such information has been used in particular as part of the Assessment Reports of the Intergovernmental Panel on Climate Change (IPCC). Ground-based and satellite remote-sensing observations provide a means to quantifying the net fluxes between the land and ocean on the one hand and the atmosphere on the other hand. This is done through a process called atmospheric inversion, which uses transport models of the atmosphere to link the observed concentrations of CO2, CH4 and N2O to the net fluxes at the Earth's surface. By correctly modelling the winds, vertical diffusion, and convection in the global atmosphere, the observed concentrations of the greenhouse gases are used to infer the surface fluxes for the last few decades. For CH4 and N2O, the flux inversions account also for the chemical loss of these greenhouse gases. The net fluxes include contributions from the natural biosphere (e.g., vegetation, wetlands) as well anthropogenic contributions (e.g., fossil fuel emissions, rice fields). The data sets for the three species are updated once or twice per year adding the most recent year to the data record, while re-processing the original data record for consistency. This is reflected by the different version numbers. In addition, fluxes for methane are available based on surface air samples only or based on a combination of surface air samples and satellite observations (reflected by an 's' in the version number). ",,CAMS,CAMS,,"Copernicus,ADS,CAMS,Atmosphere,Atmospheric,IPCC,CO2,CH4,N2O",ATMOSPHERIC,other,CAMS global inversion-optimised greenhouse gas fluxes and concentrations,1979-01-01T00:00:00Z,CAMS_GREENHOUSE_INVERSION,,available,,,,,,,available,,,,,,,,,,,,,,,,,,available,
